{
  "type": "CapabilityCellFabricationRunObservationRequest",
  "run": "6f291a0d-c3d5-4b38-9c43-ef28933b1bb9",
  "stages": [
    "capability-extraction",
    "market-discovery",
    "fabrication-plan",
    "software-fabrication",
    "sovereign-repository",
    "public-package",
    "chain-account",
    "public-deployment",
    "activitypub",
    "a2a",
    "market-offer",
    "customer-invocation",
    "identity-verification",
    "trajectory-foldback"
  ],
  "events": [
    {
      "id": "ni:///sha-256;Xsp78PykbfNcTDrhqp03kAI2BIpQ1N0m-wOFnoooT1s",
      "run": "6f291a0d-c3d5-4b38-9c43-ef28933b1bb9",
      "sequence": 0,
      "at": "2026-07-25T16:18:00.000Z",
      "previous": null,
      "type": "demand-submitted",
      "demand": {
        "capability": "observe-capability-cell-fabrication-run",
        "customer": "urn:ame:settlement-triggered-activity-publication-cell",
        "purpose": "customer-proof"
      }
    }
  ]
}
